{"argument":"All four reports share one Codex substrate; agreement is not an independent-provider vote.","book":"Matt","candidate_only":true,"controller_event_ids":["evt-matt-redteam"],"entry_id":"Matt-CH-001","identity":{"agent_instance_id":"codex-matt-redteam","assignment_id":"asg-matt-redteam","execution_id":"exec-matt-redteam","provider_family":"codex-gpt5-correlated-local","role_id":"exploit_red_team"},"kind":"challenge","non_authorizing":true,"reason_code":"QF-CORRELATED-SUBSTRATE","resolution_route":"retain dissent for external-provider or human review","run_id":"matt-r8-held-1","schema_version":"whole_bible_b01_challenge_appeal.v1","stage_attempt_id":"b01-controller-1","status":"open","target_artifact_id":"role-reports"}