{"argument":"No qualified ancient corpus is active; remembered context must remain unasserted.","book":"2Tim","candidate_only":true,"controller_event_ids":["evt-2tim-redteam"],"entry_id":"2Tim-AP-001","identity":{"agent_instance_id":"codex-2tim-redteam","assignment_id":"asg-2tim-redteam","execution_id":"exec-2tim-redteam","provider_family":"codex-gpt5-correlated-local","role_id":"exploit_red_team"},"kind":"appeal","non_authorizing":true,"reason_code":"QF-ANCIENT-CONTEXT-GAP","resolution_route":"human or separately qualified corpus review","run_id":"2tim-r8-held-1","schema_version":"whole_bible_b01_challenge_appeal.v1","stage_attempt_id":"b01-controller-1","status":"deferred_to_human","target_artifact_id":"ancient-context-role"}