{"argument":"No qualified ancient corpus is active; remembered context must remain unasserted.","book":"Jer","candidate_only":true,"controller_event_ids":["evt-jer-redteam"],"entry_id":"Jer-AP-001","identity":{"agent_instance_id":"codex-jer-redteam","assignment_id":"asg-jer-redteam","execution_id":"exec-jer-redteam","provider_family":"codex-gpt5-correlated-local","role_id":"exploit_red_team"},"kind":"appeal","non_authorizing":true,"reason_code":"QF-ANCIENT-CONTEXT-GAP","resolution_route":"human or separately qualified corpus review","run_id":"jer-r8-held-1","schema_version":"whole_bible_b01_challenge_appeal.v1","stage_attempt_id":"b01-controller-1","status":"deferred_to_human","target_artifact_id":"ancient-context-role"}